{
  "$schema": "http://json-schema.org/draft-07/schema#",
  "title": "NAFProfile",
  "type": "object",
  "required": [
    "naf",
    "label"
  ],
  "properties": {
    "naf": {
      "type": "string"
    },
    "label": {
      "type": "string"
    },
    "risks_priority": {
      "type": "array",
      "items": {
        "type": "string"
      }
    },
    "risks_mandatory": {
      "type": "array",
      "items": {
        "type": "string"
      }
    },
    "actions_recommended": {
      "type": "array",
      "items": {
        "type": "string"
      }
    },
    "legal_specific": {
      "type": "array",
      "items": {
        "type": "string"
      }
    },
    "extra_risks": {
      "type": "array",
      "items": {
        "type": "string"
      }
    },
    "extra_actions": {
      "type": "array",
      "items": {
        "type": "string"
      }
    }
  }
}