{
  "naf": "4931Z",
  "label": "Transports urbains et suburbains de voyageurs",
  "risks_priority": [
    "R-ROUTIER",
    "R-AGRESSION",
    "R-RPS"
  ],
  "risks_mandatory": [],
  "actions_recommended": [
    "A-R-ROUTIER-001",
    "A-R-AGRESSION-001"
  ],
  "legal_specific": [
    "OB-DUERP"
  ]
}