{
  "naf": "4719B",
  "label": "Commerce de d√©tail non alimentaire",
  "risks_priority": [
    "R-GLISSADES",
    "R-COUPURE",
    "R-MANUTENTION",
    "R-RPS"
  ],
  "risks_mandatory": [],
  "actions_recommended": [
    "A-R-GLISSADES-001",
    "A-R-MANUTENTION-001"
  ],
  "legal_specific": [
    "OB-DUERP"
  ]
}