{
  "naf": "4711D",
  "label": "Commerce de d√©tail alimentaire",
  "risks_priority": [
    "R-GLISSADES",
    "R-COUPURE",
    "R-MANUTENTION",
    "R-INCENDIE",
    "R-ELECTRIQUE",
    "R-RPS"
  ],
  "risks_mandatory": [],
  "actions_recommended": [
    "A-R-GLISSADES-001",
    "A-R-COUPURE-001",
    "A-R-MANUTENTION-001"
  ],
  "legal_specific": [
    "OB-DUERP",
    "OB-VERIF"
  ]
}