{
  "naf": "4711C",
  "label": "Supermarch√©s",
  "risks_priority": [
    "R-GLISSADES",
    "R-MANUTENTION",
    "R-RPS",
    "R-INCENDIE"
  ],
  "risks_mandatory": [],
  "actions_recommended": [
    "A-R-GLISSADES-001",
    "A-R-MANUTENTION-001"
  ],
  "legal_specific": [
    "OB-DUERP",
    "OB-VERIF"
  ]
}